{
  "protocolVersion": 1,
  "exportedAt": "2026-08-11T11:27:26.086Z",
  "meta": { "title": "protocol-v1 fixture", "pageUrl": "http://localhost:5199/" },
  "payload": {
    "events": [
      {
        "id": 1,
        "type": "render",
        "timestamp": 1546.4000000953674,
        "componentId": 1,
        "renderId": 1,
        "commitId": 1,
        "selfDuration": 169.79999995231628,
        "totalDuration": 162.50000023841858,
        "reasons": [{ "type": "mount" }],
        "compiler": { "compiled": true, "memoized": true }
      },
      {
        "id": 2,
        "type": "render",
        "timestamp": 1546.4000000953674,
        "componentId": 2,
        "renderId": 2,
        "commitId": 1,
        "selfDuration": 0.6000001430511475,
        "totalDuration": 0.20000004768371582,
        "reasons": [{ "type": "mount" }],
        "compiler": { "compiled": true, "memoized": true }
      },
      {
        "id": 3,
        "type": "render",
        "timestamp": 1546.4000000953674,
        "componentId": 3,
        "renderId": 3,
        "commitId": 1,
        "selfDuration": 0.2999999523162842,
        "totalDuration": 0.09999990463256836,
        "reasons": [{ "type": "mount" }],
        "compiler": { "compiled": false, "memoized": false }
      },
      {
        "id": 4,
        "type": "render",
        "timestamp": 1546.4000000953674,
        "componentId": 4,
        "renderId": 4,
        "commitId": 1,
        "selfDuration": 0.20000004768371582,
        "totalDuration": 0,
        "reasons": [{ "type": "mount" }],
        "compiler": { "compiled": false, "memoized": false }
      },
      {
        "id": 5,
        "type": "render",
        "timestamp": 1546.4000000953674,
        "componentId": 5,
        "renderId": 5,
        "commitId": 1,
        "selfDuration": 0,
        "totalDuration": 0,
        "reasons": [{ "type": "mount" }],
        "compiler": { "compiled": true, "memoized": true }
      },
      {
        "id": 6,
        "type": "render",
        "timestamp": 1546.4000000953674,
        "componentId": 6,
        "renderId": 6,
        "commitId": 1,
        "selfDuration": 1,
        "totalDuration": 0.9000000953674316,
        "reasons": [{ "type": "mount" }],
        "compiler": { "compiled": true, "memoized": true }
      },
      {
        "id": 7,
        "type": "render",
        "timestamp": 1546.4000000953674,
        "componentId": 7,
        "renderId": 7,
        "commitId": 1,
        "selfDuration": 0.7000000476837158,
        "totalDuration": 0.6000001430511475,
        "reasons": [{ "type": "mount" }],
        "compiler": { "compiled": true, "memoized": true }
      },
      {
        "id": 8,
        "type": "render",
        "timestamp": 1546.4000000953674,
        "componentId": 8,
        "renderId": 8,
        "commitId": 1,
        "selfDuration": 0.40000009536743164,
        "totalDuration": 0.40000009536743164,
        "reasons": [{ "type": "mount" }],
        "compiler": { "compiled": false, "memoized": false }
      },
      {
        "id": 9,
        "type": "render",
        "timestamp": 1546.4000000953674,
        "componentId": 9,
        "renderId": 9,
        "commitId": 1,
        "selfDuration": 0.10000014305114746,
        "totalDuration": 0.10000014305114746,
        "reasons": [{ "type": "mount" }],
        "compiler": { "compiled": true, "memoized": true }
      },
      {
        "id": 10,
        "type": "render",
        "timestamp": 1546.4000000953674,
        "componentId": 10,
        "renderId": 10,
        "commitId": 1,
        "selfDuration": 0.7999999523162842,
        "totalDuration": 0.5,
        "reasons": [{ "type": "mount" }],
        "compiler": { "compiled": true, "memoized": true }
      },
      {
        "id": 11,
        "type": "render",
        "timestamp": 1546.4000000953674,
        "componentId": 11,
        "renderId": 11,
        "commitId": 1,
        "selfDuration": 0.7999999523162842,
        "totalDuration": 0.5,
        "reasons": [{ "type": "mount" }],
        "compiler": { "compiled": true, "memoized": true }
      },
      {
        "id": 12,
        "type": "render",
        "timestamp": 1546.4000000953674,
        "componentId": 12,
        "renderId": 12,
        "commitId": 1,
        "selfDuration": 0.7000000476837158,
        "totalDuration": 0.5,
        "reasons": [{ "type": "mount" }],
        "compiler": { "compiled": true, "memoized": true }
      },
      {
        "id": 13,
        "type": "render",
        "timestamp": 1546.4000000953674,
        "componentId": 13,
        "renderId": 13,
        "commitId": 1,
        "selfDuration": 0.5999999046325684,
        "totalDuration": 0.39999985694885254,
        "reasons": [{ "type": "mount" }],
        "compiler": { "compiled": true, "memoized": true }
      },
      {
        "id": 14,
        "type": "render",
        "timestamp": 1546.4000000953674,
        "componentId": 14,
        "renderId": 14,
        "commitId": 1,
        "selfDuration": 0.5999999046325684,
        "totalDuration": 0.39999985694885254,
        "reasons": [{ "type": "mount" }],
        "compiler": { "compiled": true, "memoized": true }
      },
      {
        "id": 15,
        "type": "render",
        "timestamp": 1546.4000000953674,
        "componentId": 15,
        "renderId": 15,
        "commitId": 1,
        "selfDuration": 0.5999999046325684,
        "totalDuration": 0.39999985694885254,
        "reasons": [{ "type": "mount" }],
        "compiler": { "compiled": true, "memoized": true }
      },
      {
        "id": 16,
        "type": "render",
        "timestamp": 1546.4000000953674,
        "componentId": 16,
        "renderId": 16,
        "commitId": 1,
        "selfDuration": 0.5,
        "totalDuration": 0.2999999523162842,
        "reasons": [{ "type": "mount" }],
        "compiler": { "compiled": true, "memoized": true }
      },
      {
        "id": 17,
        "type": "render",
        "timestamp": 1546.4000000953674,
        "componentId": 17,
        "renderId": 17,
        "commitId": 1,
        "selfDuration": 0.39999985694885254,
        "totalDuration": 0.19999980926513672,
        "reasons": [{ "type": "mount" }],
        "compiler": { "compiled": true, "memoized": true }
      },
      {
        "id": 18,
        "type": "render",
        "timestamp": 1546.4000000953674,
        "componentId": 18,
        "renderId": 18,
        "commitId": 1,
        "selfDuration": 0.39999985694885254,
        "totalDuration": 0.19999980926513672,
        "reasons": [{ "type": "mount" }],
        "compiler": { "compiled": true, "memoized": true }
      },
      {
        "id": 19,
        "type": "render",
        "timestamp": 1546.4000000953674,
        "componentId": 19,
        "renderId": 19,
        "commitId": 1,
        "selfDuration": 0.39999985694885254,
        "totalDuration": 0.19999980926513672,
        "reasons": [{ "type": "mount" }],
        "compiler": { "compiled": true, "memoized": true }
      },
      {
        "id": 20,
        "type": "render",
        "timestamp": 1546.4000000953674,
        "componentId": 20,
        "renderId": 20,
        "commitId": 1,
        "selfDuration": 0.39999985694885254,
        "totalDuration": 0.19999980926513672,
        "reasons": [{ "type": "mount" }],
        "compiler": { "compiled": true, "memoized": true }
      },
      {
        "id": 21,
        "type": "render",
        "timestamp": 1546.4000000953674,
        "componentId": 21,
        "renderId": 21,
        "commitId": 1,
        "selfDuration": 0.39999985694885254,
        "totalDuration": 0.19999980926513672,
        "reasons": [{ "type": "mount" }],
        "compiler": { "compiled": true, "memoized": true }
      },
      {
        "id": 22,
        "type": "render",
        "timestamp": 1546.4000000953674,
        "componentId": 22,
        "renderId": 22,
        "commitId": 1,
        "selfDuration": 0.20000004768371582,
        "totalDuration": 0.09999990463256836,
        "reasons": [{ "type": "mount" }],
        "compiler": { "compiled": true, "memoized": true }
      },
      {
        "id": 23,
        "type": "render",
        "timestamp": 1546.4000000953674,
        "componentId": 23,
        "renderId": 23,
        "commitId": 1,
        "selfDuration": 0.10000014305114746,
        "totalDuration": 0,
        "reasons": [{ "type": "mount" }],
        "compiler": { "compiled": true, "memoized": true }
      },
      {
        "id": 24,
        "type": "render",
        "timestamp": 1546.4000000953674,
        "componentId": 24,
        "renderId": 24,
        "commitId": 1,
        "selfDuration": 0.10000014305114746,
        "totalDuration": 0,
        "reasons": [{ "type": "mount" }],
        "compiler": { "compiled": true, "memoized": true }
      },
      {
        "id": 25,
        "type": "render",
        "timestamp": 1546.4000000953674,
        "componentId": 25,
        "renderId": 25,
        "commitId": 1,
        "selfDuration": 0.10000014305114746,
        "totalDuration": 0,
        "reasons": [{ "type": "mount" }],
        "compiler": { "compiled": true, "memoized": true }
      },
      {
        "id": 26,
        "type": "render",
        "timestamp": 1546.4000000953674,
        "componentId": 26,
        "renderId": 26,
        "commitId": 1,
        "selfDuration": 0,
        "totalDuration": 0,
        "reasons": [{ "type": "mount" }],
        "compiler": { "compiled": true, "memoized": true }
      },
      {
        "id": 27,
        "type": "render",
        "timestamp": 1546.4000000953674,
        "componentId": 27,
        "renderId": 27,
        "commitId": 1,
        "selfDuration": 139.29999995231628,
        "totalDuration": 138.80000019073486,
        "reasons": [{ "type": "mount" }],
        "compiler": { "compiled": true, "memoized": true }
      },
      {
        "id": 28,
        "type": "render",
        "timestamp": 1546.4000000953674,
        "componentId": 28,